{
  "input": {
    "message": "L\u2019ouverture de session d\u2019un compte s\u2019est correctement d\u00e9roul\u00e9e.#015#012#015#012Sujet :#015#012#011ID de s\u00e9curit\u00e9 :#011#011S-1-5-18#015#012#011Nom du compte :#011#011USERNAME$#015#012#011Domaine du compte :#011#011CORPDOMAIN#015#012#011ID d\u2019ouverture de session :#011#0110x3e7#015#012#015#012Type d\u2019ouverture de session :#011#011#0115#015#012#015#012Nouvelle ouverture de session :#015#012#011ID de s\u00e9curit\u00e9 :#011#011S-1-5-18#015#012#011Nom du compte :#011#011Syst\u00e8me#015#012#011Domaine du compte :#011#011AUTORITE NT#015#012#011ID d\u2019ouverture de session :#011#0110x3e7#015#012#011GUID d\u2019ouverture de session :#011#011{00000000-0000-0000-0000-000000000000}#015#012#015#012Informations sur le processus :#015#012#011ID du processus :#011#0110x1d0#015#012#011Nom du processus :#011#011C:\\Windows\\System32\\services.exe#015#012#015#012Informations sur le r\u00e9seau :#015#012#011Nom de la station de travail :#011#015#012#011Adresse du r\u00e9seau source :#011-#015#012#011Port source :#011#011-#015#012#015#012Informations d\u00e9taill\u00e9es sur l\u2019authentification :#015#012#011Processus d\u2019ouverture de session :#011#011Advapi  #015#012#011Package d\u2019authentification :#011Negotiate#015#012#011Services en transit :#011-#015#012#011Nom du package (NTLM uniquement) :#011-#015#012#011Longueur de la cl\u00e9 :#011#0110#015#012#015#012Cet \u00e9v\u00e9nement est g\u00e9n\u00e9r\u00e9 lors de la cr\u00e9ation d\u2019une ouverture de session. Il est g\u00e9n\u00e9r\u00e9 sur l\u2019ordinateur sur lequel l\u2019ouverture de session a \u00e9t\u00e9 effectu\u00e9e.#015#012#015#012Le champ Objet indique le compte sur le syst\u00e8me local qui a demand\u00e9 l\u2019ouverture de session. Il s\u2019agit le plus souvent d\u2019un service, comme le service Serveur, ou un processus local tel que Winlogon.exe ou Services.exe.#015#012#015#012Le champ Type d\u2019ouverture de session indique le type d\u2019ouverture de session qui s\u2019est produit. Les types les plus courants sont 2 (interactif) et 3 (r\u00e9seau).#015#012#015#012Le champ Nouvelle ouverture de session indique le compte pour lequel la nouvelle ouverture de session a \u00e9t\u00e9 cr\u00e9\u00e9e, par exemple, le compte qui s\u2019est connect\u00e9.#015#012#015#012Les champs relatifs au r\u00e9seau indiquent la provenance d\u2019une demande d\u2019ouverture de session \u00e0 distance. Le nom de la station de travail n\u2019\u00e9tant pas toujours disponible, peut \u00eatre laiss\u00e9 vide dans certains cas.#015#012#015#012Les champs relatifs aux informations d\u2019authentification fournissent des d\u00e9tails sur cette demande d\u2019ouverture de session sp\u00e9cifique.#015#012#011- Le GUID d\u2019ouverture de session est un identificateur unique pouvant servir \u00e0 associer cet \u00e9v\u00e9nement \u00e0 un \u00e9v\u00e9nement KDC .#015#012#011- Les services en transit indiquent les services interm\u00e9diaires qui ont particip\u00e9 \u00e0 cette demande d\u2019ouverture de session.#015#012#011- Nom du package indique quel est le sous-protocole qui a \u00e9t\u00e9 utilis\u00e9 parmi les protocoles NTLM.#015#012#011- La longueur de la cl\u00e9 indique la longueur de la cl\u00e9 de session g\u00e9n\u00e9r\u00e9e"
  },
  "expected": {
    "message": "L\u2019ouverture de session d\u2019un compte s\u2019est correctement d\u00e9roul\u00e9e.#015#012#015#012Sujet :#015#012#011ID de s\u00e9curit\u00e9 :#011#011S-1-5-18#015#012#011Nom du compte :#011#011USERNAME$#015#012#011Domaine du compte :#011#011CORPDOMAIN#015#012#011ID d\u2019ouverture de session :#011#0110x3e7#015#012#015#012Type d\u2019ouverture de session :#011#011#0115#015#012#015#012Nouvelle ouverture de session :#015#012#011ID de s\u00e9curit\u00e9 :#011#011S-1-5-18#015#012#011Nom du compte :#011#011Syst\u00e8me#015#012#011Domaine du compte :#011#011AUTORITE NT#015#012#011ID d\u2019ouverture de session :#011#0110x3e7#015#012#011GUID d\u2019ouverture de session :#011#011{00000000-0000-0000-0000-000000000000}#015#012#015#012Informations sur le processus :#015#012#011ID du processus :#011#0110x1d0#015#012#011Nom du processus :#011#011C:\\Windows\\System32\\services.exe#015#012#015#012Informations sur le r\u00e9seau :#015#012#011Nom de la station de travail :#011#015#012#011Adresse du r\u00e9seau source :#011-#015#012#011Port source :#011#011-#015#012#015#012Informations d\u00e9taill\u00e9es sur l\u2019authentification :#015#012#011Processus d\u2019ouverture de session :#011#011Advapi  #015#012#011Package d\u2019authentification :#011Negotiate#015#012#011Services en transit :#011-#015#012#011Nom du package (NTLM uniquement) :#011-#015#012#011Longueur de la cl\u00e9 :#011#0110#015#012#015#012Cet \u00e9v\u00e9nement est g\u00e9n\u00e9r\u00e9 lors de la cr\u00e9ation d\u2019une ouverture de session. Il est g\u00e9n\u00e9r\u00e9 sur l\u2019ordinateur sur lequel l\u2019ouverture de session a \u00e9t\u00e9 effectu\u00e9e.#015#012#015#012Le champ Objet indique le compte sur le syst\u00e8me local qui a demand\u00e9 l\u2019ouverture de session. Il s\u2019agit le plus souvent d\u2019un service, comme le service Serveur, ou un processus local tel que Winlogon.exe ou Services.exe.#015#012#015#012Le champ Type d\u2019ouverture de session indique le type d\u2019ouverture de session qui s\u2019est produit. Les types les plus courants sont 2 (interactif) et 3 (r\u00e9seau).#015#012#015#012Le champ Nouvelle ouverture de session indique le compte pour lequel la nouvelle ouverture de session a \u00e9t\u00e9 cr\u00e9\u00e9e, par exemple, le compte qui s\u2019est connect\u00e9.#015#012#015#012Les champs relatifs au r\u00e9seau indiquent la provenance d\u2019une demande d\u2019ouverture de session \u00e0 distance. Le nom de la station de travail n\u2019\u00e9tant pas toujours disponible, peut \u00eatre laiss\u00e9 vide dans certains cas.#015#012#015#012Les champs relatifs aux informations d\u2019authentification fournissent des d\u00e9tails sur cette demande d\u2019ouverture de session sp\u00e9cifique.#015#012#011- Le GUID d\u2019ouverture de session est un identificateur unique pouvant servir \u00e0 associer cet \u00e9v\u00e9nement \u00e0 un \u00e9v\u00e9nement KDC .#015#012#011- Les services en transit indiquent les services interm\u00e9diaires qui ont particip\u00e9 \u00e0 cette demande d\u2019ouverture de session.#015#012#011- Nom du package indique quel est le sous-protocole qui a \u00e9t\u00e9 utilis\u00e9 parmi les protocoles NTLM.#015#012#011- La longueur de la cl\u00e9 indique la longueur de la cl\u00e9 de session g\u00e9n\u00e9r\u00e9e",
    "event": {
      "category": [
        "authentication"
      ],
      "code": "4624",
      "outcome": "success",
      "type": [
        "start"
      ]
    },
    "action": {
      "id": 4624,
      "name": "L\u2019ouverture de session d\u2019un compte s\u2019est correctement d\u00e9roul\u00e9e.",
      "outcome": "success",
      "properties": {
        "domain": "AUTORITE NT",
        "id": "S-1-5-18",
        "logon_guid": "00000000-0000-0000-0000-000000000000",
        "logon_id": "0x3e7",
        "logon_type": 5,
        "name": "Syst\u00e8me",
        "type": "targetedUser"
      },
      "target": "user",
      "type": "Security"
    },
    "os": {
      "family": "windows",
      "platform": "windows"
    },
    "process": {
      "id": "0x1d0",
      "name": "C:\\Windows\\System32\\services.exe"
    },
    "related": {
      "user": [
        "USERNAME$"
      ]
    },
    "sekoiaio": {
      "authentication": {
        "process": {
          "name": "C:\\Windows\\System32\\services.exe"
        }
      },
      "server": {
        "os": {
          "type": "windows"
        }
      }
    },
    "user": {
      "target": {
        "domain": "CORPDOMAIN",
        "id": "0x3e7",
        "name": "USERNAME$",
        "sid": "S-1-5-18"
      }
    }
  }
}